nazwa,email,www,typ,miasto
LICEUM OGÓLNOKSZTAŁCĄCE W SŁUPSKU, tedim_sekretariat@op.pl, http://www.tedim.slupsk.pl, Typ: Liceum ogólnokształcące,Słupsk
LICEUM OGÓLNOKSZTAŁCĄCE Z ODDZIAŁAMI MISTRZOSTWA SPORTOWEGO W MIASTKU, sekretariat@zsoitmiastko.pl, http://www.zsoit.miastko.pl, Typ: Liceum ogólnokształcące,Miastko
LICEUM OGÓLNOKSZTAŁCĄCE ZAOCZNE W SOPOCIE, liceum@sopot.pl, http://, Typ: Liceum ogólnokształcące,Sopot
LICEUM SŁUŻB MUNDUROWYCH W PUCKU, lsm@pozytywneinicjatywy.pl, http://lsm.pozytywneinicjatywy.pl, Typ: Liceum ogólnokształcące,Puck
MEDYCZNA SZKOŁA POLICEALNA,, http://, Typ: Szkoła policealna,Słupsk
MEDYCZNA SZKOŁA POLICEALNA W CHOJNICACH, sekretariat@szkolamedyk.eu, http://www.szkolamedyk.eu, Typ: Szkoła policealna,Chojnice
MEDYCZNE LICEUM OGÓLNOKSZTAŁCĄCE, sekretariat@zsi.slupsk.pl, http://www.zsi.slupsk.pl, Typ: Liceum ogólnokształcące,Słupsk
MEDYCZNE STUDIUM ZAWODOWE, ckz.nauka@wp.pl, http://www.nauka.etczew.eu, Typ: Szkoła policealna,Tczew
MEDYCZNE STUDIUM ZAWODOWE PRZY CENTRUM KSZTAŁCENIA ZAWODOWEGO "NAUKA" SP. Z O.O. W TCZEWIE, ckz.nauka@wp.pl, http://www.nauka.etczew.eu, Typ: Szkoła policealna,SmętowoGraniczne
MEDYCZNO- SPOŁECZNA SZKOŁA POLICEALNA  W CHOJNICACH, sekretariat@szkolamedyk.eu, http://www.szkolamedyk.eu, Typ: Szkoła policealna,Chojnice
MŁODZIEŻOWE LICEUM OGÓLNOKSZTAŁCĄCE W SŁUPSKU, liceum.nauka@wp.pl, http://, Typ: Liceum ogólnokształcące,Słupsk
NEPTUN LICEUM OGÓLNOKSZTAŁCĄCE DLA DOROSŁYCH W GDAŃSKU, gdansk@atutszkola.pl, http://www.atutszkola.pl, Typ: Liceum ogólnokształcące,Gdańsk
NEPTUN POLICEALNA SZKOŁA MEDYCZNA W GDAŃSKU, gdansk@atutszkola.pl, http://www.atutszkola.pl, Typ: Szkoła policealna,Gdańsk
NEPTUN POLICEALNA SZKOŁA ZAWODOWA W GDAŃSKU, gdansk@atutszkola.pl, http://www.atutszkola.pl, Typ: Szkoła policealna,Gdańsk
NIEPUBLICZNA POLICEALNA SZKOŁA KOMPETENCJI ZAWODOWYCH "COSINUS" W GDYNI, gdynia@cosinus.pl, http://www.cosinus.pl/gdynia, Typ: Szkoła policealna,Gdynia
NIEPUBLICZNA POLICEALNA SZKOŁA KOMPETENCJI ZAWODOWYCH "COSINUS" W SŁUPSKU, slupsk@cosinus.pl, http://www.cosinus.pl, Typ: Szkoła policealna,Słupsk
NIEPUBLICZNA POLICEALNA SZKOŁA ZAWODOWA  "ŻAK", gdynia@zak.edu.pl, https://zak.edu.pl/, Typ: Szkoła policealna,Gdynia
NIEPUBLICZNA SZKOŁA POLICEALNA  METAMORFOZA, sekretariat@metamorfoza.edu.pl, http://, Typ: Szkoła policealna,Gdańsk
NIEPUBLICZNA SZKOŁA POLICEALNA W WEJHEROWIE, zsnww@wp.pl, http://www.lodd-w.prv.pl, Typ: Szkoła policealna,Wejherowo
NIEPUBLICZNE LICEUM OGÓLNOKSZTALCĄCE SZKOŁA MISTRZOSTWA SPORTOWEGO ZWIĄZKU PIŁKI RĘCZNEJ W POLSCE, smsgdansk@zprp.org.pl, http://, Typ: Liceum ogólnokształcące,Gdańsk
NIEPUBLICZNE LICEUM OGÓLNOKSZTAŁCĄCE DLA DOROSŁYCH W WEJHEROWIE, zsnww@wp.pl, http://www.lodd-w.prv.pl, Typ: Liceum ogólnokształcące,Wejherowo
NIEPUBLICZNE LICEUM OGÓLNOKSZTAŁCĄCE IM. DR WANDY BŁEŃSKIEJ, liceum@kowale.edu.pl, http://www.liceumblenskiej.pl, Typ: Liceum ogólnokształcące,Kowale
NIEPUBLICZNE LICEUM OGÓLNOKSZTAŁCĄCE PLEJADA W GDAŃSKU, studium.novum@wp.pl, http://, Typ: Liceum ogólnokształcące,Gdańsk
NIEPUBLICZNE LICEUM OGÓLNOKSZTAŁCĄCE SZKOŁA  MISTRZOSTWA  SPORTOWEGO POLSKIEGO ZWIĄZKU KOSZYKÓWKI WE WŁADYSŁAWOWIE, smscetniewo@pzkosz.pl, http://www.sms-cetniewo.pl, Typ: Liceum ogólnokształcące,Władysławowo
NIEPUBLICZNE LICEUM OGÓLNOKSZTAŁCĄCE W KWIDZYNIE - SZKOŁA MISTRZOSTWA SPORTOWEGO ZWIĄZKU PIŁKI RĘCZNEJ W POLSCE, SEKRETARIAT@SMSKWIDZYN.PL, http://smskwidzyn.pl, Typ: Liceum ogólnokształcące,Kwidzyn
OGÓLNOKSZTAŁCĄCE LICEUM JEZUITÓW Z ODDZIAŁAMI DWUJĘZYCZNYMI IM ŚW. STANISŁAWA KOSTKI W GDYNI, liceum@jezuici.pl, https://jezuici.edu.pl/, Typ: Liceum ogólnokształcące,Gdynia
OGÓLNOKSZTAŁCĄCE LICEUM PROGRAMÓW INDYWIDUALNYCH IM. WICEADMIRAŁA JÓZEFA UNRUGA, liceum@olpi.gda.pl, http://www.olpi.pl, Typ: Liceum ogólnokształcące,Gdańsk
OLIWSKIE LICEUM OGÓLNOKSZTAŁCĄCE, sekretariat@gce.edu.pl, http://gce.edu.pl, Typ: Liceum ogólnokształcące,Gdańsk
OŚRODEK SZKOLNO-WYCHOWAWCZY NR 2 DLA NIESŁYSZĄCYCH I SŁABOSŁYSZĄCYCH IM. J. SIESTRZYŃSKIEGO W WEJHEROWIE SZKOŁA POLICEALNA DLA MŁODZIEŻY, sekretariat@osw2wejherowo.pl, http://www.osw2wejherowo.pl, Typ: Szkoła policealna,Wejherowo
OŚRODEK SZKOLNO-WYCHOWAWCZY NR 2 DLA NIESŁYSZĄCYCH I SŁABOSŁYSZĄCYCH W WEJHEROWIE TECHNIKUM NR 4 DLA NIESŁYSZĄCYCH, sekretariat@osw2wejherowo.pl, http://www.osw2wejherowo.pl, Typ: Technikum,Wejherowo
PAŃSTWOWE SZKOŁY BUDOWNICTWA W GDAŃSKU - SZKOŁA POLICEALNA DLA DOROSŁYCH NR 5, sekretariat@psb.edu.gdansk.pl, http://psb.edu.gdansk.pl, Typ: Szkoła policealna,Gdańsk
PAŃSTWOWE SZKOŁY BUDOWNICTWA W GDAŃSKU - TECHNIKUM NR 5, sekretariat@psb.edu.gdansk.pl, http://psb.edu.gdansk.pl, Typ: Technikum,Gdańsk
PIERWSZE SPOŁECZNE LICEUM OGÓLNOKSZTAŁCĄCE SZKOŁA MISTRZOSTWA SPORTOWEGO W GDYNI, bernardelli@razem.pl, http://www.gim.edu.pl, Typ: Liceum ogólnokształcące,Gdynia
POLICEALNA GDYŃSKA SZKOŁA MORSKA W GDYNI, sdk@am.gdynia.pl, http://www.amgdynia.pl/sdk, Typ: Szkoła policealna,Gdynia
POLICEALNA SZKOŁA ,,COSINUS PLUS'' W GDYNI, gdynia@cosinus.pl, http://, Typ: Szkoła policealna,Gdynia
POLICEALNA SZKOŁA "AKADEMIA SUKCESU",, http://, Typ: Szkoła policealna,StarogardGdański
POLICEALNA SZKOŁA ADMINISTRACJI EMPIRIA, empiria0@wp.pl, http://, Typ: Szkoła policealna,Gdańsk
POLICEALNA SZKOŁA AKADEMICKA W SŁUPSKU, sekretariat@zsa.edu.pl, http://zsa.edu.pl, Typ: Szkoła policealna,Słupsk
POLICEALNA SZKOŁA BHP "ALTERNATYWA" CENTRUM NAUKI, alternatywa@centrumnauki.edu.pl, http://, Typ: Szkoła policealna,Gdańsk
POLICEALNA SZKOŁA CENTRUM NAUKI I BIZNESU "ŻAK", starogard@zak.edu.pl, http://, Typ: Szkoła policealna,StarogardGdański
POLICEALNA SZKOŁA DETEKTYWÓW I PRACOWNIKÓW OCHRONY EMPIRIA, empiria0@wp.pl, http://, Typ: Szkoła policealna,Gdańsk
POLICEALNA SZKOŁA JEDNOROCZNA "AKADEMIA SUKCESU",, http://, Typ: Szkoła policealna,StarogardGdański
POLICEALNA SZKOŁA MEDYCZNA,, http://, Typ: Szkoła policealna,Słupsk
POLICEALNA SZKOŁA MEDYCZNA  "ŻAK" W STAROGARDZIE GDAŃSKIM,, http://, Typ: Szkoła policealna,StarogardGdański
POLICEALNA SZKOŁA MEDYCZNA REMEDIUM NR 1, policealnaszkola.med@gmail.com, http://, Typ: Szkoła policealna,PruszczGdański
POLICEALNA SZKOŁA MEDYCZNA REMEDIUM NR 2, policealnaszkola.med@gmail.com, http://, Typ: Szkoła policealna,PruszczGdański
POLICEALNA SZKOŁA OPIEKI MEDYCZNEJ "ŻAK" W STAROGARDZIE GDAŃSKIM,, http://, Typ: Szkoła policealna,StarogardGdański
POLICEALNA SZKOŁA TEB EDUKACJA, starogard@teb.pl, http://www.teb.pl, Typ: Szkoła policealna,StarogardGdański
POLICEALNA SZKOŁA TEB EDUKACJA, gdynia@teb-edukacja.pl, http://, Typ: Szkoła policealna,Gdynia
POLICEALNA SZKOŁA TEB EDUKACJA, slupsk@teb.pl, http://, Typ: Szkoła policealna,Słupsk
POLICEALNA SZKOŁA TEB EDUKACJA W GDAŃSKU, gdansk@teb-edukacja.pl, http://teb.pl, Typ: Szkoła policealna,Gdańsk
POLICEALNA SZKOŁA TECHNIK AUDIOWIZUALNYCH"NUWAVE" W GDAŃSKU, biuro@technik.edu.pl, http://, Typ: Szkoła policealna,Gdańsk
POLICEALNA SZKOŁA ZAWODOWA "EDUKATOR" W RUMI, kontakt@edu-kreator.pl, http://www.edu-kreator.pl, Typ: Szkoła policealna,Rumia
POLICEALNA SZKOŁA ZAWODOWA "VADEMECUM" W KOŚCIERZYNIE,, http://, Typ: Szkoła policealna,Kościerzyna
POLICEALNA SZKOŁA ZAWODOWA "ŻAK",, http://, Typ: Szkoła policealna,StarogardGdański
POLICEALNA SZKOŁA ZAWODOWA DLA DOROSŁYCH, kcevademecum@wp.pl, http://, Typ: Szkoła policealna,Kościerzyna
POLICEALNA SZKOŁA ZAWODOWA METAMORFOZA, sekretariat@metamorfoza.edu.pl, http://metamorfoza.edu.pl, Typ: Szkoła policealna,Gdańsk
POLICEALNE STUDIUM ZAWODOWE, ckz.nauka@wp.pl, http://www.nauka.etczew.eu, Typ: Szkoła policealna,Tczew
POLICEALNE STUDIUM ZAWODOWE PRZY CKZ "NAUKA" SP. Z O.O. W TCZEWIE, ckz.nauka@wp.pl, http://www.nauka.etczew.eu, Typ: Szkoła policealna,SmętowoGraniczne
POLICEALNE SZKOŁY SPARTAKUS, fundacja@bursztynowym.pl, http://, Typ: Szkoła policealna,Gdańsk
POLICYJNE LICEUM OGÓLNOKSZTAŁCĄCE NR 1 W SŁUPSKU, sekretariat@zsa.edu.pl, http://, Typ: Liceum ogólnokształcące,Słupsk
POLICYJNE LICEUM OGÓLNOKSZTAŁCĄCE W SŁUPSKU, sekretariat@zsi.slupsk.pl, http://, Typ: Liceum ogólnokształcące,Słupsk
POLSKA SZKOŁA HOMEOPATII KLASYCZNEJ, pshk@pshk.pl, http://pshk.pl/, Typ: Szkoła policealna,Gdynia
POMORSKIE LICEUM BIZNESU DLA DOROSŁYCH, dyrektor@technik.slupsk.pl, http://, Typ: Liceum ogólnokształcące,Słupsk
POMORSKIE STUDIUM BIZNESU W SŁUPSKU,, http://, Typ: Szkoła policealna,Słupsk
POMORSKIE STUDIUM SZTUK WIZUALNYCH, info@pssw.pl, http://, Typ: Szkoła policealna,Gdynia
PRESTIGE LICEUM OGÓLNOKSZTAŁCĄCE W CZERSKU,, http://, Typ: Liceum ogólnokształcące,Czersk
PRESTIGE LICEUM OGÓLNOKSZTAŁCĄCE W CZŁUCHOWIE,, http://, Typ: Liceum ogólnokształcące,Człuchów
PRESTIGE SZKOŁA POLICEALNA W CZERSKU, sekretariat@zsprestige.pl, http://, Typ: Szkoła policealna,Czersk
PROFESJA POLICEALNA SZKOŁA DOSKONALENIA ZAWODOWEGO, gdynia@profesja.edu.pl, http://, Typ: Szkoła policealna,Gdynia
PROSCHOOL LICEUM OGÓLNOKSZTAŁCĄCE DLA DOROSŁYCH W GDAŃSKU, impres.spolka@wp.pl, http://, Typ: Liceum ogólnokształcące,Gdańsk
PROSCHOOL LICEUM OGÓLNOKSZTAŁCĄCE DLA DOROSŁYCH W SŁUPSKU, sp.vertica@gmail.com, http://, Typ: Liceum ogólnokształcące,Słupsk
PROSCHOOL POLICEALNA SZKOŁA ZAWODOWA W GDAŃSKU, impres.spolka@wp.pl, http://, Typ: Szkoła policealna,Gdańsk
PROSCHOOL SZKOŁA POLICEALNA MEDYCZNA W SŁUPSKU, impres.spolka@wp.pl, http://, Typ: Szkoła policealna,Słupsk
PROSCHOOL SZKOŁA POLICEALNA ZAWODOWA W SŁUPSKU, sp.vertica@gmail.com, http://, Typ: Szkoła policealna,Słupsk
PRYMUS LICEUM OGÓLNOKSZTAŁCĄCE DLA DOROSŁYCH W SŁUPSKU, wernitospzoo@gmail.com, http://, Typ: Liceum ogólnokształcące,Słupsk
PRYMUS LICEUM OGÓLNOKSZTAŁCĄCE DLA MŁODZIEŻY W SŁUPSKU, wernitospzoo@gmail.com, http://, Typ: Liceum ogólnokształcące,Słupsk
PRYMUS POLICEALNA SZKOŁA W SŁUPSKU, wernitospzoo@gmail.com, http://, Typ: Szkoła policealna,Słupsk
PRYWATNA SZKOŁA POLICEALNA "TWOJA SZKOŁA" W SŁUPSKU, slupsk@twoja-szkola.pl, http://, Typ: Szkoła policealna,Słupsk
PRYWATNA SZKOŁA POLICEALNA DLA DOROSŁYCH 'TWOJA SZKOŁA',, http://, Typ: Szkoła policealna,StarogardGdański
PRYWATNE LICEUM OGÓLNOKSZTAŁCĄCE DLA DOROSŁYCH,, http://, Typ: Liceum ogólnokształcące,Lębork
PRYWATNE LICEUM OGÓLNOKSZTAŁCĄCE DLA DOROSŁYCH "TWOJA SZKOŁA",, http://, Typ: Liceum ogólnokształcące,StarogardGdański
PRYWATNE LICEUM OGÓLNOKSZTAŁCĄCE DLA DOROSŁYCH W SŁUPSKU, slupsk@twoja-szkola.pl, http://, Typ: Liceum ogólnokształcące,Słupsk
PRYWATNE TECHNIKUM GASTRONOMICZNE E.T.MAZUREK, dyrekcja@szkoly-mazurka.pl, http://, Typ: Technikum,Gdynia
PUBLICZNA SZKOŁA POLICEALNA "COSINUS PLUS" W GDYNI, gdynia@cosinus.pl, https://www.cosinus.pl, Typ: Szkoła policealna,Gdynia
PUBLICZNE KATOLICKIE LICEUM OGÓLNOKSZTAŁCĄCE, kat.gim@interia.pl, http://www.gimnazjumkatolickie.malbork.opoka.net.pl, Typ: Liceum ogólnokształcące,Malbork
PUCKIE LICEUM OGÓLNOKSZTAŁCĄCE,, http://, Typ: Liceum ogólnokształcące,Puck
ROCZNA  SZKOŁA POLICEALNA  GOWORK.PL W GDAŃSKU, szkola@gowork.pl, http://, Typ: Szkoła policealna,Gdańsk
SALEZJAŃSKIE LICEUM OGÓLNOKSZTAŁCĄCE IM. ŚW. JANA BOSKO W RUMI, sekretariat.slo@onet.pl, http://www.liceum.salezjanskie.pl, Typ: Liceum ogólnokształcące,Rumia
SOPOCKA AKADEMIA TENISOWA PRYWATNE LICEUM OGÓLNOKSZTAŁCĄCE, akademia@akademiatenisowa.pl, http://www.akademiatenisowa.pl, Typ: Liceum ogólnokształcące,Sopot
SOPOCKIE AUTONOMICZNE LICEUM, ssa.sekretariat@gfo.pl, http://, Typ: Liceum ogólnokształcące,Sopot
SPOŁECZNE LICEUM OGÓLNOKSZTAŁCĄCE, slo_lebork@wp.pl, http://, Typ: Liceum ogólnokształcące,Lębork
SPOŁECZNE LICEUM OGÓLNOKSZTAŁCĄCE, dyrekcjazss@wp.pl, http://, Typ: Liceum ogólnokształcące,Słupsk
SPOŁECZNE LICEUM OGÓLNOKSZTAŁCĄCE IM. POLSKICH NOBLISTÓW W KWIDZYNIE, kss.kwidzyn@idsl.pl, http://, Typ: Liceum ogólnokształcące,Kwidzyn
SPOŁECZNE LICEUM OGÓLNOKSZTAŁCĄCE W CZŁUCHOWIE,, http://, Typ: Liceum ogólnokształcące,Człuchów
SPOŁECZNE TECHNIKUM W SŁUPSKU, dyrekcjazss@wp.pl, http://, Typ: Technikum,Słupsk
SPORTOWE LICEUM OGÓLNOKSZTAŁCĄCE W KWIDZYNIE ZESPÓŁ SZKÓŁ OGÓLNOKSZTAŁCĄCYCH NR 2 W KWIDZYNIE, wyspian@2lo-kwidzyn.pl, http://www.2lokwidzyn.msi.pl, Typ: Liceum ogólnokształcące,Kwidzyn
SSI LICEUM OGÓLNOKSZTAŁCĄCE DLA DOROSŁYCH W SŁUPSKU, slupsk@atutszkola.pl, http://, Typ: Liceum ogólnokształcące,Słupsk
SSI LICEUM OGÓLNOKSZTAŁCĄCE DLA MŁODZIEŻY W SŁUPSKU, slupsk@atutszkola.pl, http://, Typ: Liceum ogólnokształcące,Słupsk
SSI POLICEALNA SZKOŁA ZAWODOWA W SŁUPSKU, slupsk@atutszkola.pl, http://, Typ: Szkoła policealna,Słupsk
SSI SZKOŁA POLICEALNA MEDYCZNA W SŁUPSKU, slupsk@atutszkola.pl, http://, Typ: Szkoła policealna,Słupsk
STACJONARNA POLICEALNA SZKOŁA MEDYCZNA "PASCAL" W CHOJNICACH, chojnice@pascal.edu.pl, http://www.pascal.edu.pl, Typ: Szkoła policealna,Chojnice
STACJONARNA POLICEALNA SZKOŁA MEDYCZNA "PASCAL" W TCZEWIE, tczew@pascal.edu.pl, http://, Typ: Szkoła policealna,Tczew
STAROGARDZKIE AUTONOMICZNE LICEUM OGÓLNOKSZTAŁCĄCE, ssa2004@wp.pl, http://, Typ: Liceum ogólnokształcące,StarogardGdański
STUDIUM HANDLU ZAGRANICZNEGO, OBSŁUGI CELNEJ I SPEDYCJI W GDYNI, elkforum_edu@wp.pl, http://, Typ: Szkoła policealna,Gdynia
STUDIUM MEDYCZNE TEB EDUKACJA, gdansk@teb-edukacja.pl, http://teb.pl, Typ: Szkoła policealna,Gdańsk
STUDIUM MEDYCZNE TEB EDUKACJA, starogard@teb.pl, http://www.teb.pl, Typ: Szkoła policealna,StarogardGdański
STUDIUM MEDYCZNE TEB EDUKACJA, gdynia@teb-edukacja.pl, http://, Typ: Szkoła policealna,Gdynia
STUDIUM MEDYCZNE TEB EDUKACJA W SŁUPSKU, slupsk@teb.pl, http://, Typ: Szkoła policealna,Słupsk
STUDIUM ZDROWIA I URODY,, http://, Typ: Szkoła policealna,StarogardGdański
SZKOŁA  POLICEALNA W TCZEWIE, dyrektor@zkz.tczew.pl, http://www.zkz.tczew.pl, Typ: Szkoła policealna,Tczew
SZKOŁA  TRADYCYJNEJ MEDYCYNY CHIŃSKIEJ  TOMO, medycynaorientalna@medycynaorientalna.pl, http://, Typ: Szkoła policealna,Gdańsk
SZKOŁA MISTRZOSTWA SPORTOWEGO LICEUM OGÓLNOKSZTAŁCĄCE MARCINA GORTATA W GDAŃSKU, sekretariatgdansk@szkolagortata.pl, http://www.szkolagortata.pl, Typ: Liceum ogólnokształcące,Gdańsk
SZKOŁA MORSKA W GDYNI, szkola@morska.edu.pl, http://, Typ: Szkoła policealna,Gdynia
SZKOŁA POLICEALNA,, http://, Typ: Szkoła policealna,Skarszewy
SZKOŁA POLICEALNA, sekretariat@zspskorcz.pl, http://www.zspskorcz.pl, Typ: Szkoła policealna,Skórcz
SZKOŁA POLICEALNA, sekretariat@zsoit.miastko.pl, http://www.zsoit.miastko.pl, Typ: Szkoła policealna,Miastko
SZKOŁA POLICEALNA  KOSMETYCZNA "ŻAK", gdynia@zak.edu.pl, https://zak.edu.pl/, Typ: Szkoła policealna,Gdynia
SZKOŁA POLICEALNA "COSINUS PLUS" W GDAŃSKU, gdansk@cosinus.pl, http://, Typ: Szkoła policealna,Gdańsk
SZKOŁA POLICEALNA "COSINUS PLUS" W SŁUPSKU, slupsk@cosinus.pl, https://www.cosinus.pl/slupsk, Typ: Szkoła policealna,Słupsk
SZKOŁA POLICEALNA "MATRIX" W KARTUZACH, w.kwiatkowska@matrix.szkola.pl, http://www.matrix.szkola.pl, Typ: Szkoła policealna,Kartuzy
SZKOŁA POLICEALNA ADMINISTRACYJNO-FINANSOWA NR 2 W WEJHEROWIE, zsp3wejher@wp.pl, http://www.zsp3.wejher.pl, Typ: Szkoła policealna,Wejherowo
SZKOŁA POLICEALNA AKTYWIZACJI ZAWODOWEJ "ŻAK" W KWIDZYNIE, centrala@zak.edu.pl, http://www.zak.edu.pl, Typ: Szkoła policealna,Kwidzyn
SZKOŁA POLICEALNA BEZPIECZEŃSTWA PUBLICZNEGO NR 1 W WEJHEROWIE, sekretariat@wejherowo-elektryk.pl, http://www.wejherowo-elektryk.pl, Typ: Szkoła policealna,Wejherowo
SZKOŁA POLICEALNA CENTRUM NAUKI I BIZNESU "ŻAK" GDAŃSKU, gdansk@zak.edu.pl, http://zak.edu.pl/gdansk, Typ: Szkoła policealna,Gdańsk
SZKOŁA POLICEALNA CENTRUM NAUKI I BIZNESU "ŻAK" W GDYNI, gdynia@zak.edu.pl, https://zak.edu.pl/, Typ: Szkoła policealna,Gdynia
SZKOŁA POLICEALNA CKU CZŁUCHÓW,, http://, Typ: Szkoła policealna,Człuchów
SZKOŁA POLICEALNA CNIB"ŻAK" W KWIDZYNIE, centrala@zak.edu.pl, http://www.zak.edu.pl, Typ: Szkoła policealna,Kwidzyn
SZKOŁA POLICEALNA DLA DOROSŁYCH,, http://, Typ: Szkoła policealna,Kościerzyna
SZKOŁA POLICEALNA DLA DOROSŁYCH,, http://, Typ: Szkoła policealna,Skarszewy
SZKOŁA POLICEALNA DLA DOROSŁYCH, cku_sztum@sw.gov.pl, http://, Typ: Szkoła policealna,Sztum
SZKOŁA POLICEALNA DLA DOROSŁYCH W USTCE, zsoitustka@wp.pl, http://, Typ: Szkoła policealna,Ustka
SZKOŁA POLICEALNA DLA DOROSŁYCH W ZESPOLE SZKÓŁ ZAWODOWYCH W BARLEWICZKACH W CENTRUM KSZTAŁCENIA USTAWICZNEGO, sekretariat.barlewiczki@op.pl, http://www.barlewiczki.pl, Typ: Szkoła policealna,Sztum
SZKOŁA POLICEALNA FARMACEUTYCZNA W GDAŃSKU, farmacja.orunia@wp.pl, http://szkoly.stopkapress.com.pl, Typ: Szkoła policealna,Gdańsk
SZKOŁA POLICEALNA FARMACEUTYCZNA W SŁUPSKU, zsa.slupsk@wp.pl, http://, Typ: Szkoła policealna,Słupsk
SZKOŁA POLICEALNA GDAŃSKIE STUDIUM ADMINISTRACJI, b.prus@oswiatalingwista.eu, http://szkoly-medyczne.eu, Typ: Szkoła policealna,Gdańsk
SZKOŁA POLICEALNA GDAŃSKIE STUDIUM FARMACEUTYCZNE, b.prus@oswiatalingwista.eu, http://szkoly-medyczne.eu, Typ: Szkoła policealna,Gdańsk
SZKOŁA POLICEALNA INFORMATYKI ŻAK W GDAŃSKU, gdansk@zak.edu.pl, http://zak.edu.pl/gdansk, Typ: Szkoła policealna,Gdańsk
SZKOŁA POLICEALNA KOSMETYCZNA "ŻAK" W GDAŃSKU, gdansk@zak.edu.pl, http://zak.edu.pl/gdansk, Typ: Szkoła policealna,Gdańsk
SZKOŁA POLICEALNA KOSMETYCZNA OMEGA, omegagda@wp.pl, http://omega.gdansk.pl, Typ: Szkoła policealna,Gdańsk
SZKOŁA POLICEALNA MECHANICZNA NR 3 W WEJHEROWIE, sekretariat@zspg4.wejher.pl, http://www.pzs4.wejher.pl, Typ: Szkoła policealna,Wejherowo
SZKOŁA POLICEALNA MEDYCZNA IM. ALINY PIENKOWSKIEJ W GDYNI, sekretariat@msz.vti.pl, http://www.wzspgdynia.pl, Typ: Szkoła policealna,Gdynia
SZKOŁA POLICEALNA MEDYCZNA W SŁUPSKU, zsm_sl@wp.pl, http://www.medyk.slupsk.pl, Typ: Szkoła policealna,Słupsk
SZKOŁA POLICEALNA MEDYCZNA W STAROGARDZIE GDAŃSKIM, mszstarogard@poczta.onet.pl, http://www.medyk-stg.pl, Typ: Szkoła policealna,StarogardGdański
SZKOŁA POLICEALNA MEDYCZNA W SZTUMIE, sekretariat@medyk.sztum.pl, http://www.medyk.sztum.pl, Typ: Szkoła policealna,Sztum
SZKOŁA POLICEALNA MEDYCZNA ŻAK W GDAŃSKU, gdansk@zak.edu.pl, http://, Typ: Szkoła policealna,Gdańsk
SZKOŁA POLICEALNA MEDYCZNA ŻAK W KWIDZYNIE, kwidzyn@zak.edu.pl, http://www.zak.edu.pl, Typ: Szkoła policealna,Kwidzyn
SZKOŁA POLICEALNA MEDYCZNO-SPOŁECZNA NR 4 W WEJHEROWIE, sekretariat@medyk-wejherowo.pl, http://www.medyk-wejherowo.pl, Typ: Szkoła policealna,Wejherowo
SZKOŁA POLICEALNA NIEDALEKO W GDAŃSKU, jola.grzesiuk@wp.pl, http://, Typ: Szkoła policealna,Gdańsk
SZKOŁA POLICEALNA NR 1, sekretariat@ckziu1.edu.gdynia.pl, https://ckziu1gdynia.wixsite.com/ckziu1gdynia/o-szkole, Typ: Szkoła policealna,Gdynia
SZKOŁA POLICEALNA NR 1 DLA DOROSŁYCH, sekretariat@zsoio.pl, http://www.zsoio.pl, Typ: Szkoła policealna,PruszczGdański
SZKOŁA POLICEALNA NR 1 W BYTOWIE, dyrekcja@lo.bytow.pl, http://www.lo.bytow.pl, Typ: Szkoła policealna,Bytów
SZKOŁA POLICEALNA NR 1 W KWIDZYNIE ZESPÓŁ SZKÓŁ NR 1 IM. STANISŁAWA STASZICA W KWIDZYNIE, zsp1@zsp1kwidzyn.pl, http://, Typ: Szkoła policealna,Kwidzyn
SZKOŁA POLICEALNA NR 1 W SŁUPSKU, kontakt@szkoly-slupsk.pl, http://szkoly-slupsk.pl/, Typ: Szkoła policealna,Słupsk
SZKOŁA POLICEALNA NR 1 W SOPOCIE, zsh@sopot.pl, http://, Typ: Szkoła policealna,Sopot
SZKOŁA POLICEALNA NR 10, sekretariat@ckziu3.edu.gdynia.pl, https://ckziunr3.pl/, Typ: Szkoła policealna,Gdynia
SZKOŁA POLICEALNA NR 10 W SŁUPSKU,, http://, Typ: Szkoła policealna,Słupsk
SZKOŁA POLICEALNA NR 2 DLA DOROSŁYCH, sekretariat@zschie.edu.gdynia.pl, https://zschie.pl/, Typ: Szkoła policealna,Gdynia
SZKOŁA POLICEALNA NR 2 W KWIDZYNIE ZESPÓŁ SZKÓŁ NR 2 IM. MARII SKŁODOWSKIEJ - CURIE W KWIDZYNIE, zsp2@zsp2kwidzyn.pl, http://www.zsp2.ckj.edu.pl, Typ: Szkoła policealna,Kwidzyn
SZKOŁA POLICEALNA NR 2 W LĘBORKU,, http://, Typ: Szkoła policealna,Lębork
SZKOŁA POLICEALNA NR 2 W SOPOCIE, zaoczny@sopot.pl, http://, Typ: Szkoła policealna,Sopot
SZKOŁA POLICEALNA NR 3 W GDYNI, sekretariat@zset.edu.gdynia.pl, http://www.zsetgdynia.pl/, Typ: Szkoła policealna,Gdynia
SZKOŁA POLICEALNA NR 3 W KWIDZYNIE CENTRUM KSZTAŁCENIA ZAWODOWEGO I USTAWICZNEGO W KWIDZYNIE, ckziu@ckziukwidzyn.edu.pl, http://www.zst.kwidzyn.pl, Typ: Szkoła policealna,Kwidzyn
SZKOŁA POLICEALNA NR 4, sekretariat@zsae.edu.gdynia.pl, http://www.zsae.gdynia.pl/, Typ: Szkoła policealna,Gdynia
SZKOŁA POLICEALNA NR 4 W KWIDZYNIE,, http://, Typ: Szkoła policealna,Kwidzyn
SZKOŁA POLICEALNA NR 5 DLA DOROSŁYCH, sekretariat@ckziu2.edu.gdynia.pl, https://ckziu2-gdynia.edupage.org/, Typ: Szkoła policealna,Gdynia
SZKOŁA POLICEALNA NR 5 W KWIDZYNIE ZESPÓŁ SZKÓŁ NR 1 IM. STANISŁAWA STASZICA W KWIDZYNIE, zsp1@zsp1kwidzyn.pl, http://, Typ: Szkoła policealna,Kwidzyn
SZKOŁA POLICEALNA NR 6, sekretariat@zshg.edu.gdynia.pl, http://zshg.pl/, Typ: Szkoła policealna,Gdynia
SZKOŁA POLICEALNA NR 6 W KWIDZYNIE ZESPÓŁ SZKÓŁ NR 2 IM. MARII SKŁODOWSKIEJ - CURIE W KWIDZYNIE, zsp2@zsp2kwidzyn.pl, http://www.zsp2.ckj.edu.pl, Typ: Szkoła policealna,Kwidzyn
SZKOŁA POLICEALNA NR 8 DLA DOROSŁYCH, sekretariat@ckziu1.edu.gdynia.pl, https://ckziu1gdynia.wixsite.com/ckziu1gdynia/o-szkole, Typ: Szkoła policealna,Gdynia
SZKOŁA POLICEALNA OMEGA W GDAŃSKU, sekretariat@cedo.edu.pl, http://www.cedo.edu.pl, Typ: Szkoła policealna,Gdańsk
SZKOŁA POLICEALNA OPIEKI MEDYCZNEJ ,,ŻAK" W GDYNI, gdynia@zak.edu.pl, https://zak.edu.pl/, Typ: Szkoła policealna,Gdynia
SZKOŁA POLICEALNA OPIEKI MEDYCZNEJ "ŻAK" W KWIDZYNIE,, http://, Typ: Szkoła policealna,Kwidzyn
SZKOŁA POLICEALNA OPIEKI MEDYCZNEJ ŻAK W GDAŃSKU, centrala@zak.edu.pl, http://, Typ: Szkoła policealna,Gdańsk
SZKOŁA POLICEALNA PRAWNO-ADMINISTRACYJNA "ŻAK", gdynia@zak.edu.pl, https://zak.edu.pl/, Typ: Szkoła policealna,Gdynia
SZKOŁA POLICEALNA PROGRES W CZŁUCHOWIE,, http://, Typ: Szkoła policealna,Debrzno
SZKOŁA POLICEALNA PRYMUS, prymuslebork.info@wp.pl, http://, Typ: Szkoła policealna,Lębork
SZKOŁA POLICEALNA SPOŁECZNA IM. ALINY PIENKOWSKIEJ W GDYNI, sekretariat@msz.vti.pl, http://www.wzspgdynia.pl, Typ: Szkoła policealna,Gdynia
SZKOŁA POLICEALNA SPOŁECZNA W SŁUPSKU, zsm_sl@wp.pl, http://www.medyk.slupsk.pl, Typ: Szkoła policealna,Słupsk
SZKOŁA POLICEALNA SPOŁECZNA W STAROGARDZIE GDAŃSKIM, mszstarogard@poczta.onet.pl, http://www.medyk-stg.pl, Typ: Szkoła policealna,StarogardGdański
SZKOŁA POLICEALNA SPOŁECZNA W SZTUMIE, dyrektor@medyk.sztum.pl, http://www.medyk.sztum.pl, Typ: Szkoła policealna,Sztum
SZKOŁA POLICEALNA STUDIUM PRACOWNIKÓW MEDYCZNYCH I SPOŁECZNYCH,, http://, Typ: Szkoła policealna,Kościerzyna
SZKOŁA POLICEALNA STUDIUM PRACOWNIKÓW MEDYCZNYCH I SPOŁECZNYCH, info@oswiatalingwista.eu, http://, Typ: Szkoła policealna,Gdańsk
SZKOŁA POLICEALNA STUDIUM PRACOWNIKÓW MEDYCZNYCH I SPOŁECZNYCH, lebork@oswiatalingwista.eu, http://www.osr.lebork.pl,szkolymedyczne.eu, Typ: Szkoła policealna,Lębork
SZKOŁA POLICEALNA W CHOJNICACH, poczta@ckziuchojnice.pl, http://ckziuchojnice.pl, Typ: Szkoła policealna,Chojnice
SZKOŁA POLICEALNA W CZARNEJ WODZIE,, http://, Typ: Szkoła policealna,CzarnaWoda
SZKOŁA POLICEALNA W KŁANINIE W POWIATOWYM ZESPOLE SZKÓŁ IM. STANISŁAWA STASZICA W KŁANINIE, zspklanino@wp.pl, http://www.pzsklanino.edu.pl, Typ: Szkoła policealna,Starzyno
SZKOŁA POLICEALNA W LUZINIE, luzino-vademecum@wp.pl, http://www.vademecum.strona.pl, Typ: Szkoła policealna,Luzino
SZKOŁA POLICEALNA W PUCKU W POWIATOWYM CENTRUM KSZTAŁCENIA ZAWODOWEGO I USTAWICZNEGO W PUCKU, kancelaria@pckziu-puck.pl, http://www.pckziu-puck-pl, Typ: Szkoła policealna,Puck
SZKOŁA POLICEALNA W SŁUPSKU, sekretariat@scku.slupsk.pl, http://scku.slupsk.pl, Typ: Szkoła policealna,Słupsk
SZKOŁA POLICEALNA W ZESPOLE SZKÓŁ W DZIERZGONIU, zs_dzierzgon@poczta.onet.pl, http://www.zsdzierzgon.edu.pl/, Typ: Szkoła policealna,Dzierzgoń
SZKOŁA POLICEALNA WIELOBRANŻOWA NR 5 W WEJHEROWIE, sekretariat@medyk-wejherowo.pl, http://www.medyk-wejherowo.pl, Typ: Szkoła policealna,Wejherowo
SZKOŁA POLICEALNA WIELOBRANŻOWA W REDZIE, szkola@zspreda.pl, http://pzsreda.edu.pl/, Typ: Szkoła policealna,Reda
SZKOŁA POLICEALNA WIELOBRANŻOWA W RUMI, sekretariat@hipolit.info.pl, http://www.hipolit.info, Typ: Szkoła policealna,Rumia
SZKOŁA TECHNICZNA BYDGOSKIEGO ZAKŁADU DOSKONALENIA ZAWODOWEGO W CHOJNICACH, chojnice@bzdz.pl, http://www.bzdz.pl/technikum-mundurowe-chojnice/, Typ: Technikum,Chojnice
SZKOŁY EKONOMICZNO-HANDLOWE IM. MACIERZY SZKOLNEJ W GDAŃSKU TECHNIKUM NR 11 W GDAŃSKU, sekretariat@seh.edu.gdansk.pl, http://seh.edu.gdansk.pl, Typ: Technikum,Gdańsk
SZKOŁY OKRĘTOWE I TECHNICZNE "CONRADINUM" W GDAŃSKU TECHNIKUM NR 18, sekretariat@conradinum.edu.gdansk.pl, http://conradinum.edu.gdansk.pl, Typ: Technikum,Gdańsk
SZKOŁY PRUSA LICEUM OGÓLNOKSZTAŁCĄCE DLA DOROSŁYCH W GDAŃSKU, sekretariat@szkolyprusa.edu.pl, http://szkolyatena.pl, Typ: Liceum ogólnokształcące,Gdańsk
TECHNIKUM, sekretariat@zsoitmiastko.pl, http://www.zsoit.miastko.pl, Typ: Technikum,Miastko
TECHNIKUM, szkola@boleslawowo.pl, http://www.boleslawowo.pl, Typ: Technikum,Skarszewy
TECHNIKUM, zsndg@wp.pl, http://www.zs2ndg.szkolnastrona.pl, Typ: Technikum,NowyDwórGdański
TECHNIKUM 4-LETNIE, szkola@zsckrswarozyn.pl, http://www.zsckrswarozyn.pl, Typ: Technikum,Swarożyn
