nazwa,email,www,typ,miasto
 SZKOŁA POLICEALNA NR 1 W BIELSKU PODLASKIM, zsznr4bp@op.pl, http://www.zsnr4.ovh.org, Typ: Szkoła policealna,BielskPodlaski
"EDUCENTRUM" POLICEALNA SZKOŁA MEDYCZNA W BIAŁYMSTOKU, biuro@educentrum.com.pl, http://, Typ: Szkoła policealna,Białystok
AKADEMICKA POLICEALNA SZKOŁA MEDYCZNA W BIAŁYMSTOKU, biuro@wsmed.pl, http://wsmed.edu.pl, Typ: Szkoła policealna,Białystok
AKADEMICKA SZKOŁA POLICEALNA DLA DOROSŁYCH, azsp@pwsip.edu.pl, http://www.pwsip.edu.pl/azsp, Typ: Szkoła policealna,Łomża
AKADEMICKA SZKOŁA POLICEALNA W ŁOMŻY, azsp@pwsip.edu.pl, http://www.pwsip.edu.pl/azsp, Typ: Szkoła policealna,Łomża
AKADEMICKA SZKOŁA PONADPODSTAWOWA W ŁOMŻY, asp@wsa.edu.pl, http://zsa.wsa.edu.pl/, Typ: Technikum,Łomża
AKADEMICKIE LICEUM OGÓLNOKSZTAŁCĄCE W ŁOMŻY, asp@wsa.edu.pl, http://zsa.wsa.edu.pl/, Typ: Liceum ogólnokształcące,Łomża
AKADEMICKIE MEDYCZNE LICEUM OGÓLNOKSZTAŁCĄCE W BIAŁYMSTOKU, biuro@wsmed.pl, http://, Typ: Liceum ogólnokształcące,Białystok
AUGUSTOWSKIE CENTRUM EDUKACYJNE SZKOŁA POLICEALNA NR 1 W AUGUSTOWIE, ace@acedu.pl, http://www.acedu.pl, Typ: Szkoła policealna,Augustów
AUGUSTOWSKIE CENTRUM EDUKACYJNE W AUGUSTOWIE TECHNIKUM NR 1 W AUGUSTOWIE IM. 2 KORPUSU POLSKIEGO, ace@acedu.pl, http://www.acedu.pl, Typ: Technikum,Augustów
AURO LICEUM OGÓLNOKSZTAŁCĄCE DLA DOROSŁYCH W BIAŁYMSTOKU, bialystok@atutszkola.pl, http://www.atutszkola.pl, Typ: Liceum ogólnokształcące,Białystok
AURO POLICEALNA SZKOŁA ZAWODOWA W BIAŁYMSTOKU, bialystok@atutszkola.pl, http://, Typ: Szkoła policealna,Białystok
BIAŁOSTOCKA SZKOŁA REALNA, kontakt.fundacjapro@gmail.com, http://, Typ: Liceum ogólnokształcące,Białystok
CENTRUM ZAWODÓW MEDYCZNYCH I SPOŁECZNYCH - SZKOŁA POLICEALNA WOJEWÓDZTWA PODLASKIEGO W BIAŁYMSTOKU, sekretariat@sp1oz.pl, http://sp1oz.pl/index.php, Typ: Szkoła policealna,Białystok
EUROPEJSKA SZKOŁA STYLIZACJI "VENA ART", biuro@venaart.com, http://, Typ: Szkoła policealna,Białystok
I LICEUM OGÓLNOKSZTAŁCĄCE CN-B IM. POLSKICH SPADOCHRONIARZY W BIAŁYMSTOKU, bialystok@cnb-feniks.edu.pl, http://www.szkolyfeniks.pl, Typ: Liceum ogólnokształcące,Białystok
I LICEUM OGÓLNOKSZTAŁCĄCE DLA DOROSŁYCH W ŁOMŻY, info@zckpiu.pl, http://www.zckpiu.pl, Typ: Liceum ogólnokształcące,Łomża
I LICEUM OGÓLNOKSZTAŁCĄCE DLA DOROSŁYCH ZAOCZNE W BIELSKU PODLASKIM, zsbielsk@webmedia.com.pl, http://www.zs1bielsk.ehost.pl, Typ: Liceum ogólnokształcące,BielskPodlaski
I LICEUM OGÓLNOKSZTAŁCĄCE IM. ADAMA MICKIEWICZA W BIAŁYMSTOKU, lo1@um.bialystok.pl, http://www.ilo.pl, Typ: Liceum ogólnokształcące,Białystok
I LICEUM OGÓLNOKSZTAŁCĄCE IM. ADAMA MICKIEWICZA W KOLNIE, zspkolno@op.pl, http://www.1lokolno.pl, Typ: Liceum ogólnokształcące,Kolno
I LICEUM OGÓLNOKSZTAŁCĄCE IM. ADAMA MICKIEWICZA W ŁAPACH, lolapy@lo-lapy.org, http://www.lo-lapy.pl, Typ: Liceum ogólnokształcące,Łapy
I LICEUM OGÓLNOKSZTAŁCĄCE IM. MARII SKŁODOWSKIEJ CURIE  W HAJNÓWCE, sekretariat@zsohajnowka.pl, http://www.zsohajnowka.pl, Typ: Liceum ogólnokształcące,Hajnówka
I LICEUM OGÓLNOKSZTAŁCĄCE IM. MIKOŁAJA KOPERNIKA W GRAJEWIE, lograjewo@op.pl, https://zs1grajewo.edupage.org/, Typ: Liceum ogólnokształcące,Grajewo
I LICEUM OGÓLNOKSZTAŁCĄCE IM. STANISŁAWA KONARSKIEGO W ZAMBROWIE, sekretariatlo@powiatzambrowski.com, https://lo.powiatzambrowski.com, Typ: Liceum ogólnokształcące,Zambrów
I LICEUM OGÓLNOKSZTAŁCĄCE IM. TADEUSZA KOŚCIUSZKI W BIELSKU PODLASKIM, 1lo_bielsk_podlaski@wp.pl, http://www.1lobielskpodlaski.edupage.org, Typ: Liceum ogólnokształcące,BielskPodlaski
I LICEUM OGÓLNOKSZTAŁCĄCE IM. TADEUSZA KOŚCIUSZKI W ŁOMŻY, zso.lomza@gmail.com, http://1lo.lomza.pl, Typ: Liceum ogólnokształcące,Łomża
I LICEUM OGÓLNOKSZTAŁCĄCE Z ODDZIAŁAMI DWUJĘZYCZNYMI IM. MARII KONOPNICKIEJ W SUWAŁKACH, sekretariat@1lo.suwalki.eu, http://www.1lo.suwalki.pl, Typ: Liceum ogólnokształcące,Suwałki
I SPOŁECZNE LICEUM OGÓLNOKSZTAŁCĄCE W BIAŁYMSTOKU, slosto@slosto.biaman.pl, http://slosto.pl, Typ: Liceum ogólnokształcące,Białystok
II LICEUM OGÓLNOKSZTAŁCĄCE,, http://, Typ: Liceum ogólnokształcące,Łapy
II LICEUM OGÓLNOKSZTAŁCĄCE DLA DOROSŁYCH, liceum@liceum.net, http://liceum.net, Typ: Liceum ogólnokształcące,CzarnaBiałostocka
II LICEUM OGÓLNOKSZTAŁCĄCE DLA DOROSŁYCH IM. KARDYNAŁA STEFANA WYSZYŃSKIEGO W KOLNIE, zstkolno@wp.pl, http://www.zstkolno.pl, Typ: Liceum ogólnokształcące,Kolno
II LICEUM OGÓLNOKSZTAŁCĄCE DLA DOROSŁYCH IM. STANISŁAWA STASZICA W ŁOMŻY, edu@praca.org.pl, http://, Typ: Liceum ogólnokształcące,Łomża
II LICEUM OGÓLNOKSZTAŁCĄCE DLA DOROSŁYCH W BIAŁYMSTOKU ZESPOŁU SZKÓŁ OGÓLNOKSZTAŁCĄCYCH NR 3 W BIAŁYMSTOKU, zso3@um.bialystok.pl, http://, Typ: Liceum ogólnokształcące,Białystok
II LICEUM OGÓLNOKSZTAŁCĄCE DLA DOROSŁYCH W MICHAŁOWIE,, http://, Typ: Liceum ogólnokształcące,Michałowo
II LICEUM OGÓLNOKSZTAŁCĄCE IM. GEN. ZYGMUNTA PODHORSKIEGO W SUWAŁKACH, sekretariat@zs2.suwalki.eu, http://www.zs2.suwalki.pl, Typ: Liceum ogólnokształcące,Suwałki
II LICEUM OGÓLNOKSZTAŁCĄCE IM. KARDYNAŁA STEFANA WYSZYŃSKIEGO W KOLNIE, zstkolno@wp.pl, http://www.zstkolno.pl, Typ: Liceum ogólnokształcące,Kolno
II LICEUM OGÓLNOKSZTAŁCĄCE IM. KSIĘŻNEJ ANNY Z SAPIEHÓW JABŁONOWSKIEJ W BIAŁYMSTOKU ZESPOŁU SZKÓŁ OGÓLNOKSZTAŁCĄCYCH NR 2 W BIAŁYMSTOKU, zso2@um.bialystok.pl, http://www.zso2bialystok.pl, Typ: Liceum ogólnokształcące,Białystok
II LICEUM OGÓLNOKSZTAŁCĄCE IM. MARII KONOPNICKIEJ W ŁOMŻY, 2lolomza@onet.eu, http://www.lomza2lo.webd.pl, Typ: Liceum ogólnokształcące,Łomża
II LICEUM OGÓLNOKSZTAŁCĄCE W AUGUSTOWIE IM. POLONII I POLAKÓW NA ŚWIECIE, 2lo@st.augustow.wrotapodlasia.pl, http://www.lo2.augustow.pl, Typ: Liceum ogólnokształcące,Augustów
II LICEUM OGÓLNOKSZTAŁCĄCE W GRAJEWIE, zsnr2grajewo@wp.pl, http://www.zs2.grajewo.pl, Typ: Liceum ogólnokształcące,Grajewo
II LICEUM OGÓLNOKSZTAŁCĄCE W ZAMBROWIE, zs1rowecki@powiatzambrowski.com, http://www.zs1rowecki.pl, Typ: Liceum ogólnokształcące,Zambrów
II LICEUM OGÓLNOKSZTAŁCĄCE Z BIAŁORUSKIM JĘZYKIEM NAUCZANIA IM BRONISŁAWA TARASZKIEWICZA W BIELSKU PODLASKIM, lozbjn@gmail.com, http://www.lozbjn.edu.pl, Typ: Liceum ogólnokształcące,BielskPodlaski
II LICEUM OGÓLNOKSZTAŁCĄCE Z DODATKOWĄ NAUKĄ JĘZYKA BIAŁORUSKIEGO W HAJNÓWCE, sekretariat@bialorushajnowka.pl, http://www.bialorus.hajnowka.pl, Typ: Liceum ogólnokształcące,Hajnówka
II SPOŁECZNE LICEUM OGÓLNOKSZTAŁCĄCE IM. JANA PAWŁA II W BIAŁYMSTOKU, 2slo@wp.pl, http://, Typ: Liceum ogólnokształcące,Białystok
III LICEUM OGÓLNOKSZTAŁCĄCE DLA DOROSŁYCH W BIAŁYMSTOKU CENTRUM KSZTAŁCENIA USTAWICZNEGO W BIAŁYMSTOKU, cku@um.bialystok.pl, http://www.ckubialystok.pl, Typ: Liceum ogólnokształcące,Białystok
III LICEUM OGÓLNOKSZTAŁCĄCE DLA DOROSŁYCH W ŁOMŻY, osz.lomza@op.pl, http://, Typ: Liceum ogólnokształcące,Łomża
III LICEUM OGÓLNOKSZTAŁCĄCE IM. KRZYSZTOFA KAMILA BACZYŃSKIEGO W BIAŁYMSTOKU ZESPOŁU SZKÓŁ OGÓLNOKSZTAŁCĄCYCH NR 3 W BIAŁYMSTOKU, zso3@um.bialystok.pl, http://3lo.bialystok.pl, Typ: Liceum ogólnokształcące,Białystok
III LICEUM OGÓLNOKSZTAŁCĄCE IM. ŻOŁNIERZY OBWODU ŁOMŻYŃSKIEGO ARMII KRAJOWEJ W ŁOMŻY, sekretariat@lo3.lomza.pl, http://www.lo3.lomza.pl, Typ: Liceum ogólnokształcące,Łomża
III LICEUM OGÓLNOKSZTAŁCĄCE W ZAMBROWIE, zsazambrow@op.pl, http://www.zsa.powiatzambrowski.com, Typ: Liceum ogólnokształcące,Zambrów
III LICEUM OGÓLNOKSZTAŁCĄCE Z ODDZIAŁAMI DWUJĘZYCZNYMI IM. ALFREDA LITYŃSKIEGO W SUWAŁKACH, sekretariat@zs1.suwalki.eu, http://www.zs1.suwalki.edu.pl, Typ: Liceum ogólnokształcące,Suwałki
IV LICEUM OGÓLNOKSZTAŁCĄCE IM. CYPRIANA KAMILA NORWIDA W BIAŁYMSTOKU, lo4@um.bialystok.pl, http://, Typ: Liceum ogólnokształcące,Białystok
IV LICEUM OGÓLNOKSZTAŁCĄCE W ŁOMŻY, zielona210@op.pl, http://www.zielona21.lomza.pl, Typ: Liceum ogólnokształcące,Łomża
IX LICEUM OGÓLNOKSZTAŁCĄCE W BIAŁYMSTOKU ZESPOŁU SZKÓŁ OGÓLNOKSZTAŁCĄCYCH I TECHNICZNYCH W BIAŁYMSTOKU, zsoit@um.bialystok.pl, http://, Typ: Liceum ogólnokształcące,Białystok
KATOLICKIE LICEUM OGÓLNOKSZTAŁCĄCE IM. KARDYNAŁA STEFANA WYSZYŃSKIEGO W ŁOMŻY, kglolomza@wp.pl, http://www.szkolykatolickie.lomza.pl, Typ: Liceum ogólnokształcące,Łomża
KATOLICKIE LICEUM OGÓLNOKSZTAŁCĄCE IM. MATKI BOŻEJ MIŁOSIERDZIA W BIAŁYMSTOKU, klo.bialystok@wp.pl, http://, Typ: Liceum ogólnokształcące,Białystok
LICEUM INFOTECH, fprr@adres.pl, http://, Typ: Liceum ogólnokształcące,Białystok
LICEUM MISTRZOSTWA SPORTOWEGO JAGIELLONIA W BIAŁYMSTOKU, sms@jagiellonia.pl, http://www.jagiellonia.pl, Typ: Liceum ogólnokształcące,Białystok
LICEUM MISTRZOSTWA SPORTOWEGO W ŁOMŻY, azsp@pwsip.edu.pl, http://www.pwsip.edu.pl/azsp, Typ: Liceum ogólnokształcące,Łomża
LICEUM OGÓLNOKSZATŁCĄCE DLA DOROSŁYCH NR I W WYSOKIEM MAZOWIECKIEM, sekretariat@jagiellonczyk.org.pl, http://, Typ: Liceum ogólnokształcące,WysokieMazowieckie
LICEUM OGÓLNOKSZATŁCĄCE DLA DOROSŁYCH W CIECHANOWCU, zsoiz-ciechanowiec@wp.pl, http://www.zsoiz-ciechanowiec.pl, Typ: Liceum ogólnokształcące,Ciechanowiec
LICEUM OGÓLNOKSZATŁCĄCE DLA DOROSŁYCH W CZYŻEWIE, sekretariat@zsoiz-czyzew.pl, http://www.zsoiz-czyzew.pl, Typ: Liceum ogólnokształcące,Czyżew
LICEUM OGÓLNOKSZATŁCĄCE IM. ROTMISTRZA WITOLDA PILECKIEGO W CIECHANOWCU, zsoiz-ciechanowiec@wp.pl, http://www.zsoiz-ciechanowiec.pl, Typ: Liceum ogólnokształcące,Ciechanowiec
LICEUM OGÓLNOKSZATŁCĄCE IM.KRÓLA KAZIMIERZA JAGIELLOŃCZYKA W WYSOKIEM MAZOWIECKIEM, sekretariat@jagiellonczyk.org.pl, http://www.jagiellonczyk.org.pl, Typ: Liceum ogólnokształcące,WysokieMazowieckie
LICEUM OGÓLNOKSZTAŁCĄCE, zsrostrozany@siemiatycze.pl, http://zsrostrozany.edupage.org, Typ: Liceum ogólnokształcące,Drohiczyn
LICEUM OGÓLNOKSZTAŁCĄCE, czartajew@poczta.onet.pl, http://www.zsr-czartajew.pl, Typ: Liceum ogólnokształcące,Siemiatycze
LICEUM OGÓLNOKSZTAŁCĄCE, liceum@liceum.net, http://liceum.net, Typ: Liceum ogólnokształcące,CzarnaBiałostocka
LICEUM OGÓLNOKSZTAŁCĄCE BENEDYKTA W DROHICZYNIE, liceum@szkolybenedykta.pl, http://szkolybenedykta.pl, Typ: Liceum ogólnokształcące,Drohiczyn
LICEUM OGÓLNOKSZTAŁCĄCE CENTRUM SZKÓŁ MUNDUROWYCH W BIAŁYMSTOKU, sekretariat.bialystok@locsm.edu.pl, http://, Typ: Liceum ogólnokształcące,Białystok
LICEUM OGÓLNOKSZTAŁCĄCE CENTRUM SZKÓŁ MUNDUROWYCH W BIAŁYMSTOKU, sekretariat.bialystok@locsm.edu.pl, http://www.locsm.edu.pl/bialystok/, Typ: Liceum ogólnokształcące,Białystok
LICEUM OGÓLNOKSZTAŁCĄCE DLA DOROSŁYCH "AKADEMIA SUKCESU" W SUWAŁKACH, suwalki@as.edu.pl, http://, Typ: Liceum ogólnokształcące,Suwałki
LICEUM OGÓLNOKSZTAŁCĄCE DLA DOROSŁYCH "EKSPERT" W BIAŁYMSTOKU, EKSPERT_EDU@WP.PL, http://, Typ: Liceum ogólnokształcące,Białystok
LICEUM OGÓLNOKSZTAŁCĄCE DLA DOROSŁYCH "MENTOR" W GRAJEWIE, grajewo@centrumedu.pl, http://www.grajewo.centrumedu.pl, Typ: Liceum ogólnokształcące,Grajewo
LICEUM OGÓLNOKSZTAŁCĄCE DLA DOROSŁYCH "MENTOR" W GRAJEWIE, lucbag@o2.pl, http://, Typ: Liceum ogólnokształcące,Grajewo
LICEUM OGÓLNOKSZTAŁCĄCE DLA DOROSŁYCH "ŻAK" W BIAŁYMSTOKU, bialystok@zak.edu.pl, http://www.zak.edu.pl, Typ: Liceum ogólnokształcące,Białystok
LICEUM OGÓLNOKSZTAŁCĄCE DLA DOROSŁYCH "ŻAK" W ŁOMŻY, lomza@zak.edu.pl, http://, Typ: Liceum ogólnokształcące,Łomża
LICEUM OGÓLNOKSZTAŁCĄCE DLA DOROSŁYCH "ŻAK" W SUWAŁKACH,, http://, Typ: Liceum ogólnokształcące,Suwałki
LICEUM OGÓLNOKSZTAŁCĄCE DLA DOROSŁYCH NR II W WYSOKIEM MAZOWIECKIEM, ckzwmsekr@go2.pl, http://www.ckzwm.edu.pl, Typ: Liceum ogólnokształcące,WysokieMazowieckie
LICEUM OGÓLNOKSZTAŁCĄCE DLA DOROSŁYCH W DĄBROWIE BIAŁOSTOCKIEJ, liceum@data.pl, http://, Typ: Liceum ogólnokształcące,DąbrowaBiałostocka
LICEUM OGÓLNOKSZTAŁCĄCE DLA DOROSŁYCH W GRAJEWIE, lograjewo@op.pl, http://www.lograjewo.pl, Typ: Liceum ogólnokształcące,Grajewo
LICEUM OGÓLNOKSZTAŁCĄCE DLA DOROSŁYCH W HAJNÓWCE, hajnowka@ckedukator.pl, http://www.hajnowka.ckedukator.pl, Typ: Liceum ogólnokształcące,Hajnówka
LICEUM OGÓLNOKSZTAŁCĄCE DLA DOROSŁYCH W HAJNÓWCE ZAKŁADU DOSKONALENIA ZAWODOWEGO W BIAŁYMSTOKU, hajnowka@zdz.bialystok.pl, http://www.zdz.bialystok.pl, Typ: Liceum ogólnokształcące,Hajnówka
LICEUM OGÓLNOKSZTAŁCĄCE DLA DOROSŁYCH W JEDWABNEM,, http://, Typ: Liceum ogólnokształcące,Jedwabne
LICEUM OGÓLNOKSZTAŁCĄCE DLA DOROSŁYCH W ŁAPACH,, http://, Typ: Liceum ogólnokształcące,Łapy
LICEUM OGÓLNOKSZTAŁCĄCE DLA DOROSŁYCH W MOŃKACH, sekretariat@zsmonki.pl, http://www.zsmonki.pl, Typ: Liceum ogólnokształcące,Mońki
LICEUM OGÓLNOKSZTAŁCĄCE DLA DOROSŁYCH W SIEMIATYCZACH ZAKŁADU DOSKONALENIA ZAWODOWEGO W BIAŁYMSTOKU, siemiatycze@zdz.bialystok.pl, http://szkolenia.zdz.bialystok.pl/siemiatycze/, Typ: Liceum ogólnokształcące,Siemiatycze
LICEUM OGÓLNOKSZTAŁCĄCE DLA DOROSŁYCH W SOKÓŁCE, sekretariat@liceumsokolka.pl, http://www.liceumsokolka.pl, Typ: Liceum ogólnokształcące,Sokółka
LICEUM OGÓLNOKSZTAŁCĄCE DLA DOROSŁYCH W SOKÓŁCE ZAKŁADU DOSKONALENIA ZAWODOWEGO W BIAŁYMSTOKU, sokolka@zdz.bialystok.pl, http://, Typ: Liceum ogólnokształcące,Sokółka
LICEUM OGÓLNOKSZTAŁCĄCE DLA DOROSŁYCH W SUWAŁKACH,, http://, Typ: Liceum ogólnokształcące,Suwałki
LICEUM OGÓLNOKSZTAŁCĄCE DLA DOROSŁYCH W ZAMBROWIE ZAKŁADU DOSKONALENIA ZAWODOWEGO W BIAŁYMSTOKU, zambrow@zdz.bialystok.pl, http://www.szkolyzdz.pl, Typ: Liceum ogólnokształcące,Zambrów
LICEUM OGÓLNOKSZTAŁCĄCE DLA DOROSŁYCH ZAOCZNE TOWARZYSTWA WIEDZY POWSZECHNEJ W BIAŁYMSTOKU, nauka@twp.bialystok.pl, http://, Typ: Liceum ogólnokształcące,Białystok
LICEUM OGÓLNOKSZTAŁCĄCE DLA DOROSŁYCH ZESPOŁU SZKÓŁ LOGIZ W BIAŁYMSTOKU, logiz@wp.pl, http://www.logiz.edu.pl, Typ: Liceum ogólnokształcące,Białystok
LICEUM OGÓLNOKSZTAŁCĄCE IM. CYPRIANA KAMILA NORWIDA W MOŃKACH, sekretariat@zsmonki.pl, http://www.zsmonki.pl, Typ: Liceum ogólnokształcące,Mońki
LICEUM OGÓLNOKSZTAŁCĄCE IM. J.I. KRASZEWSKIEGO W DROHICZYNIE,, http://, Typ: Liceum ogólnokształcące,Drohiczyn
LICEUM OGÓLNOKSZTAŁCĄCE IM. KS. JERZEGO POPIEŁUSZKI W SUCHOWOLI, sekretariat@losuchowola.edu.pl, http://www.losuchowola.edu.pl, Typ: Liceum ogólnokształcące,Suchowola
LICEUM OGÓLNOKSZTAŁCĄCE IM. MIKOŁAJA KOPERNIKA W SOKÓŁCE, sekretariat@liceumsokolka.pl, http://www.liceumsokolka.pl, Typ: Liceum ogólnokształcące,Sokółka
LICEUM OGÓLNOKSZTAŁCĄCE IM. SZYMONA KONARSKIEGO W SEJNACH, zso.sejny@op.pl, http://www.liceum.sejny.pl, Typ: Liceum ogólnokształcące,Sejny
LICEUM OGÓLNOKSZTAŁCĄCE INTEGRACYJNE W BIAŁYMSTOKU ZESPOŁU SZKÓŁ TECHNICZNYCH I OGÓLNOKSZTAŁCĄCYCH Z ODDZIAŁAMI INTEGRACYJNYMI IM. STANISŁAWA STASZICA W BIAŁYMSTOKU, zstio@um.bialystok.pl, http://www.zstio.net.pl, Typ: Liceum ogólnokształcące,Białystok
LICEUM OGÓLNOKSZTAŁCĄCE POLITECHNIKI BIAŁOSTOCKIEJ W BIAŁYMSTOKU, liceum@pb.edu.pl, http://www.pb.edu.pl, Typ: Liceum ogólnokształcące,Białystok
LICEUM OGÓLNOKSZTAŁCĄCE SŁONECZNA SZKOŁA, wolnaedu@onet.pl, http://wolnaedu.pl, Typ: Liceum ogólnokształcące,Białystok
LICEUM OGÓLNOKSZTAŁCĄCE SŁUŻB MUNDUROWYCH WSAP W BIAŁYMSTOKU, wsap@wsap.edu.pl, http://wsap.edu.pl/wsap/, Typ: Liceum ogólnokształcące,Białystok
LICEUM OGÓLNOKSZTAŁCĄCE SPECJALNE W AUGUSTOWIE PRZY MŁODZIEŻOWYM OŚRODKU WYCHOWAWCZYM NR 4, mow4augustow@onet.pl, http://, Typ: Liceum ogólnokształcące,Augustów
LICEUM OGÓLNOKSZTAŁCĄCE SPECJALNE W GONIĄDZU, sekretariat@mowgoniadz.pl, http://www.mowgoniadz.pl, Typ: Liceum ogólnokształcące,Goniądz
LICEUM OGÓLNOKSZTAŁCĄCE TEB EDUKACJA DLA DOROSŁYCH W BIAŁYMSTOKU, bialystok@teb.pl, http://, Typ: Liceum ogólnokształcące,Białystok
LICEUM OGÓLNOKSZTAŁCĄCE W BRAŃSKU, zsbransk@wp.pl, http://zsbransk.edupage.org, Typ: Liceum ogólnokształcące,Brańsk
LICEUM OGÓLNOKSZTAŁCĄCE W CZYŻEWIE, sekretariat@zsoiz-czyzew.pl, http://www.zsoiz-czyzew.pl, Typ: Liceum ogólnokształcące,Czyżew
LICEUM OGÓLNOKSZTAŁCĄCE W DĄBROWIE BIAŁOSTOCKIEJ, liceum@data.pl, http://www.liceum-data.pl, Typ: Liceum ogólnokształcące,DąbrowaBiałostocka
LICEUM OGÓLNOKSZTAŁCĄCE W HAJNÓWCE ZAKŁADU DOSKONALENIA ZAWODOWEGO W BIAŁYMSTOKU, hajnowka@zdz.bialystok.pl, http://www.zdz.bialystok.pl, Typ: Liceum ogólnokształcące,Hajnówka
LICEUM OGÓLNOKSZTAŁCĄCE W JEDWABNEM, gimnazjumjedwabne@wp.pl, http://www.zsjedwabne.internetdsl.pl, Typ: Liceum ogólnokształcące,Jedwabne
LICEUM OGÓLNOKSZTAŁCĄCE W KNYSZYNIE IM. PROF. CZESŁAWA KUDZINOWSKIEGO,, http://, Typ: Liceum ogólnokształcące,Knyszyn
LICEUM OGÓLNOKSZTAŁCĄCE W KRZYŻEWIE, zsr.krzyzewo@wp.pl, http://www.zsrkrzyzewo.pl, Typ: Liceum ogólnokształcące,Sokoły
LICEUM OGÓLNOKSZTAŁCĄCE W MICHAŁOWIE,, http://, Typ: Liceum ogólnokształcące,Michałowo
LICEUM OGÓLNOKSZTAŁCĄCE W NIEĆKOWIE, nieckowo@poczta.onet.pl, http://www.zsnieckowo.com.pl, Typ: Liceum ogólnokształcące,Szczuczyn
LICEUM OGÓLNOKSZTAŁCĄCE W SIEMIATYCZACH, sek.lo@wp.pl, http://www.lo-siemiatycze.edu.pl, Typ: Liceum ogólnokształcące,Siemiatycze
LICEUM OGÓLNOKSZTAŁCĄCE W SOKÓŁCE ZAKŁADU DOSKONALENIA ZAWODOWEGO W BIAŁYMSTOKU, sokolka@zdz.bialystok.pl, http://www.sokolka.zdz.bialystok.pl, Typ: Liceum ogólnokształcące,Sokółka
LICEUM OGÓLNOKSZTAŁCĄCE W SZCZUCZYNIE, zswszczuczynie@op.pl, http://www.zsszczuczyn.pl, Typ: Liceum ogólnokształcące,Szczuczyn
LICEUM OGÓLNOKSZTAŁCĄCE W ZESPOLE SZKÓŁ W DOWSPUDZIE, zs.dowspuda@onet.pl, http://www.zs.dowspuda.pl, Typ: Liceum ogólnokształcące,Raczki
LICEUM OGÓLNOKSZTAŁCĄCE WSAP W BIAŁYMSTOKU, wsap@wsap.edu.pl, http://wsap.edu.pl/wsap/, Typ: Liceum ogólnokształcące,Białystok
LICEUM OGÓLNOKSZTAŁCĄCE Z LITEWSKIM JĘZYKIEM NAUCZANIA IM. 11 MARCA W PUŃSKU, licpunsk@gmail.com, http://licejus.eu, Typ: Liceum ogólnokształcące,Puńsk
LICEUM OGÓLNOKSZTAŁCĄCE ZAKŁADU DOSKONALENIA ZAWODOWEGO W BIAŁYMSTOKU Z SIEDZIBĄ W SUWAŁKACH, suwalki@zdz.bialystok.pl, http://, Typ: Liceum ogólnokształcące,Suwałki
LICEUM OGÓLNOKSZTAŁCĄCE ZAOCZNE DLA DOROSŁYCH W BIAŁYMSTOKU, kancelaria@spo.edu.pl, http://www.spo.edu.pl, Typ: Liceum ogólnokształcące,Białystok
LICEUM OGÓLNOKSZTAŁCĄCE ZAOCZNE ZAKŁADU DOSKONALENIA ZAWODOWEGO W BIAŁYMSTOKU, szkoly@zdz.bialystok.pl, http://www.zdz.bialystok.pl, Typ: Liceum ogólnokształcące,Białystok
MUNDUROWE LICEUM OGÓLNOKSZTAŁCĄCE DLA DOROSŁYCH W BIAŁYMSTOKU, mlo.bialystok@certus.edu.pl, http://www.certus.edu.pl, Typ: Liceum ogólnokształcące,Białystok
NIEPUBLICZNE LICEUM OGÓLNOKSZTAŁCĄCE DLA DOROSŁYCH W MOŃKACH,, http://, Typ: Liceum ogólnokształcące,Mońki
NIEPUBLICZNE LICEUM ŚW. ŚW. CYRYLA I METODEGO W BIAŁYMSTOKU, sekretariat@szkolacim.pl, http://www.szkolacim.pl, Typ: Liceum ogólnokształcące,Białystok
NOVA LICEUM OGÓLNOKSZTAŁCĄCE DLA DOROSŁYCH W BIAŁYMSTOKU, bialystok@nova.edu.pl, http://www.nova.edu.pl, Typ: Liceum ogólnokształcące,Białystok
NOVA POLICEALNA SZKOŁA PROMOCJI KADR DLA DOROSŁYCH W BIAŁYMSTOKU, warszawa@nova.edu.pl, http://www.nova.edu.pl, Typ: Szkoła policealna,Białystok
NOVA POLICEALNA SZKOŁA ZAWODOWA W BIAŁYMSTOKU, bialystok@nova.edu.pl, http://www.nova.edu.pl, Typ: Szkoła policealna,Białystok
POLICEALNA SZKOŁA  NR 2 W ŁOMŻY, info@zckpiu.pl, http://www.zckpiu.pl, Typ: Szkoła policealna,Łomża
POLICEALNA SZKOŁA 'EDUKATOR" W HAJNÓWCE, hajnowka@ckedukator.pl, http://www.hajnowka.ckedukator.pl, Typ: Szkoła policealna,Hajnówka
POLICEALNA SZKOŁA "AKADEMIA SUKCESU" W SUWAŁKACH, suwalki.sekretariat@as.edu.pl, http://, Typ: Szkoła policealna,Suwałki
POLICEALNA SZKOŁA "COSINUS" W BIAŁYMSTOKU, bialystok@cosinus.pl, http://, Typ: Szkoła policealna,Białystok
POLICEALNA SZKOŁA "PRYMUS I" W BIAŁYMSTOKU, kancelaria@spo.edu.pl, http://www.spo.edu.pl, Typ: Szkoła policealna,Białystok
POLICEALNA SZKOŁA "PRYMUS" W BIAŁYMSTOKU, kancelaria@spo.edu.pl, http://www.spo.edu.pl, Typ: Szkoła policealna,Białystok
POLICEALNA SZKOŁA ADMINISTRACJI "AKADEMIA SUKCESU" W BIAŁYMSTOKU, biuro@as.edu.pl, http://, Typ: Szkoła policealna,Białystok
POLICEALNA SZKOŁA DETEKTYWÓW I PRACOWNIKÓW OCHRONY W BIAŁYMSTOKU, bialystok@certus.edu.pl, http://www.certus.edu.pl, Typ: Szkoła policealna,Białystok
POLICEALNA SZKOŁA DLA DOROSŁYCH "COSINUS PLUS" W BIAŁYMSTOKU, bialystok@cosinus.pl, http://www.cosinus.pl, Typ: Szkoła policealna,Białystok
POLICEALNA SZKOŁA EDUX W BIAŁYMSTOKU, szkola.edux@gmail.com, http://, Typ: Szkoła policealna,Białystok
POLICEALNA SZKOŁA JEDNOROCZNA "AKADEMIA SUKCESU" W BIAŁYMSTOKU, biuro@as.edu.pl, http://www.as.edu.pl, Typ: Szkoła policealna,Białystok
POLICEALNA SZKOŁA TEB EDUKACJA W BIAŁYMSTOKU, bialystok@teb.pl, http://www.teb.pl, Typ: Szkoła policealna,Białystok
POLICEALNA SZKOŁA TOWARZYSTWA WIEDZY POWSZECHNEJ W BIAŁYMSTOKU, nauka@twp.bialystok.pl, http://, Typ: Szkoła policealna,Białystok
POLICEALNA SZKOŁA ZAWODOWA MERITUM SP. Z O.O. W BIAŁYMSTOKU, szkola.meritum@onet.pl, http://meritum.bialystok.pl, Typ: Szkoła policealna,Białystok
POLICEALNA SZKOŁA ZAWODOWA NR 1 W ŁOMŻY, sekwet@wp.pl, http://, Typ: Szkoła policealna,Łomża
POLICEALNA SZKOŁA ZAWODOWA W SUWAŁKACH "UNIWERSUS" SP. Z O.O., office@uniwersus.com, http://, Typ: Szkoła policealna,Suwałki
POLICEALNE STUDIUM KOSMETYCZNE "BEAUTY EXPERT", SUBE@OP.PL, http://, Typ: Szkoła policealna,Białystok
POLICEALNE STUDIUM OBSŁUGI SPEDYCYJNO - CELNEJ W BIAŁYMSTOKU, elkforum_edu@wp.pl, http://www.szkolycelne.infoserwis.elk.pl/info-bialystok.html, Typ: Szkoła policealna,Białystok
POLICEALNE STUDIUM ZAWODOWE "EKSPERT" W BIAŁYMSTOKU, ekspert_edu@wp.pl, http://, Typ: Szkoła policealna,Białystok
PROFESJA LICEUM OGÓLNOKSZTAŁCĄCE DLA DOROSŁYCH W BIAŁYMSTOKU, verticasekretariat@gmail.com, http://, Typ: Liceum ogólnokształcące,Białystok
PRYWATNE LICEUM OGÓLNOKSZTAŁCĄCE NIEPAŃSTWOWEJ WYŻSZEJ SZKOŁY PEDAGOGICZNEJ W BIAŁYMSTOKU, zsnwsp@gmail.com, http://, Typ: Liceum ogólnokształcące,Białystok
PRYWATNE LICEUM OGÓLNOKSZTAŁCĄCE W SUWAŁKACH, sekretariat@akademiadcs.edu.pl, http://, Typ: Liceum ogólnokształcące,Suwałki
ROCZNA SZKOŁA POLICEALNA GOWORK.PL W BIAŁYMSTOKU, szkola@gowork.pl, http://www.szkola.gowork.pl, Typ: Szkoła policealna,Białystok
STUDIUM HANDLU ZAGRANICZNEGO, OBSŁUGI CELNEJ I SPEDYCJI W BIAŁYMSTOKU, forumelk@op.pl, http://www.szkolycelne.infoserwis.elk.pl/info-bialystok.html, Typ: Szkoła policealna,Białystok
STUDIUM MEDYCZNE TEB EDUKACJA W BIAŁYMSTOKU, bialystok@teb.pl, http://www.teb.pl, Typ: Szkoła policealna,Białystok
STUDIUM PSYCHOLOGII PSYCHOTRONICZNEJ W BIAŁYMSTOKU, irena@studiumzycia.pl, http://, Typ: Szkoła policealna,Białystok
SUWALSKA SZKOŁA BIZNESU W SUWAŁKACH LICEUM OGÓLNOKSZTAŁCĄCE DLA DOROSŁYCH, gmk5@op.pl, http://, Typ: Liceum ogólnokształcące,Suwałki
SUWALSKA SZKOŁA BIZNESU W SUWAŁKACH SZKOŁA POLICEALNA, gmk5@op.pl, http://, Typ: Szkoła policealna,Suwałki
SZKOŁA MEDYCZNA GOWORK.PL W BIAŁYMSTOKU, szkola@gowork.pl, http://www.szkola.gowork.pl, Typ: Szkoła policealna,Białystok
SZKOŁA POLICEALNA, czartajew@poczta.onet.pl, http://www.zsr-czartajew.pl, Typ: Szkoła policealna,Siemiatycze
SZKOŁA POLICEALNA  NR 1 W WYSOKIEM MAZOWIECKIEM, sekretariat@jagiellonczyk.org.pl, http://www.jagiellonczyk.org.pl, Typ: Szkoła policealna,WysokieMazowieckie
SZKOŁA POLICEALNA  NR 2 W WYSOKIEM MAZOWIECKIEM, zesp_szk_zaw@o2.pl, http://, Typ: Szkoła policealna,WysokieMazowieckie
SZKOŁA POLICEALNA  NR 3 W WYSOKIEM MAZOWIECKIEM, ckzwmsekr@go2.pl, http://ckzwm.edu.pl, Typ: Szkoła policealna,WysokieMazowieckie
SZKOŁA POLICEALNA  PRAWNO - ADMINISTRACYJNA "ŻAK" W ŁOMŻY,, http://, Typ: Szkoła policealna,Łomża
SZKOŁA POLICEALNA  W BIELSKU PODLASKIM ZAKŁADU DOSKONALENIA ZAWODOWEGO W BIAŁYMSTOKU, bielsk@zdz.bialystok.pl, http://, Typ: Szkoła policealna,BielskPodlaski
SZKOŁA POLICEALNA  W CIECHANOWCU, zsoiz-ciechanowiec@wp.pl, http://zsoiz-ciechanowiec.pl, Typ: Szkoła policealna,Ciechanowiec
SZKOŁA POLICEALNA ADMINISTRACJI W ŁOMŻY, osz.lomza@op.pl, http://, Typ: Szkoła policealna,Łomża
SZKOŁA POLICEALNA CENTRUM NAUKI I BIZNESU "ŻAK" W BIAŁYMSTOKU, bialystok@zak.edu.pl, http://, Typ: Szkoła policealna,Białystok
SZKOŁA POLICEALNA CENTRUM NAUKI I BIZNESU "ŻAK" W ŁOMŻY, lomza@zak.edu.pl, http://, Typ: Szkoła policealna,Łomża
SZKOŁA POLICEALNA CENTRUM NAUKI I BIZNESU "ŻAK" W SUWAŁKACH,, http://, Typ: Szkoła policealna,Suwałki
SZKOŁA POLICEALNA DLA DOROSŁYCH NR 2 W SEJNACH, zso.sejny@op.pl, http://www.liceum.sejny.pl, Typ: Szkoła policealna,Sejny
SZKOŁA POLICEALNA DLA DOROSŁYCH W CZARNEJ BIAŁOSTOCKIEJ, liceum@liceum.net, http://liceum.net, Typ: Szkoła policealna,CzarnaBiałostocka
SZKOŁA POLICEALNA DLA DOROSŁYCH W DĄBROWIE BIAŁOSTOCKIEJ,, http://, Typ: Szkoła policealna,DąbrowaBiałostocka
SZKOŁA POLICEALNA FARMACEUTYCZNA W AUGUSTOWIE, psfaugustow@stopkapress.com.pl, http://, Typ: Szkoła policealna,Augustów
SZKOŁA POLICEALNA FARMACEUTYCZNA W ŁOMŻY, jola@stopkapress.com.pl, http://www.szkoly.stopkapress.com.pl, Typ: Szkoła policealna,Łomża
SZKOŁA POLICEALNA GOWORK.PL W BIAŁYMSTOKU, szkola@gowork.pl, http://www.szkola.gowork.pl, Typ: Szkoła policealna,Białystok
